PT	AU	BA	CA	GP	RI	OI	BE	Z2	TI	X1	Y1	Z1	FT	PN	AE	Z3	SO	S1	SE	BS	VL	IS	SI	MA	BP	EP	AR	DI	D2	EA	EY	SU	PD	PY	AB	X4	Y4	Z4	AK	CT	CY	SP	CL	TC	Z8	ZR	ZB	ZS	Z9	U1	U2	SN	EI	BN	UT	PM	J	Chen, Wen-Jinn								Minimizing number of tardy jobs on a single machine subject to periodic maintenance								OMEGA-INTERNATIONAL JOURNAL OF MANAGEMENT SCIENCE				37	3			591	599		10.1016/j.omega.2008.01.001					JUN 2009	2009										52	3	0	1	0	55			0305-0483			WOS:000259851900010		J	Caramia, M.; Guerriero, F.				Guerriero, Francesca/F-7670-2013	Guerriero, Francesca/0000-0002-3887-1317; Caramia, Massimiliano/0000-0002-9925-1306			A heuristic approach to long-haul freight transportation with multiple objective functions								OMEGA-INTERNATIONAL JOURNAL OF MANAGEMENT SCIENCE				37	3			600	614		10.1016/j.omega.2008.02.001					JUN 2009	2009										32	0	0	1	0	32			0305-0483			WOS:000259851900011		J	Klein, Jonathan H.								Ackoff's Fables revisited: stories to inform operational research practice								OMEGA-INTERNATIONAL JOURNAL OF MANAGEMENT SCIENCE				37	3			615	623		10.1016/j.omega.2008.02.006					JUN 2009	2009										0	0	0	0	0	0			0305-0483			WOS:000259851900012		J	Pentico, David W.; Drake, Matthew J.; Toews, Carl					Drake, Matthew/0000-0002-7777-8916			The deterministic EPQ with partial backordering: A new approach								OMEGA-INTERNATIONAL JOURNAL OF MANAGEMENT SCIENCE				37	3			624	636		10.1016/j.omega.2008.03.002					JUN 2009	2009										61	0	0	1	0	61			0305-0483			WOS:000259851900013		J	Hong, Sung-Pil; Kim, Kyung Min; Lee, Kyungsik; Park, Bum Hwan					KIM, KYUNGMIN/0000-0001-7491-9595			A pragmatic algorithm for the train-set routing: The case of Korea high-speed railway								OMEGA-INTERNATIONAL JOURNAL OF MANAGEMENT SCIENCE				37	3			637	645		10.1016/j.omega.2008.03.003					JUN 2009	2009										25	2	0	3	0	27			0305-0483			WOS:000259851900014		J	Yao, Don-Qing; Yue, Xiaohang; Mukhopadhyay, Samar K.; Wang, Ziping								Strategic inventory deployment for retail and e-tail stores								OMEGA-INTERNATIONAL JOURNAL OF MANAGEMENT SCIENCE				37	3			646	658		10.1016/j.omega.2008.04.001					JUN 2009	2009										37	7	0	0	0	44			0305-0483			WOS:000259851900015		J	Sevastjanov, Pavel; Dymova, Ludmila					Dymova, Ludmila/0000-0002-5387-9990; Sevastjanov, Pavel/0000-0003-0401-4525			Stock screening with use of multiple criteria decision making and optimization								OMEGA-INTERNATIONAL JOURNAL OF MANAGEMENT SCIENCE				37	3			659	671		10.1016/j.omega.2008.04.002					JUN 2009	2009										16	1	0	0	0	17			0305-0483			WOS:000259851900016		J	Shimshak, Daniel G.; Lenard, Melanie L.; Klimberg, Ronald K.								Incorporating quality into data envelopment analysis of nursing home performance: A case study								OMEGA-INTERNATIONAL JOURNAL OF MANAGEMENT SCIENCE				37	3			672	685		10.1016/j.omega.2008.05.004					JUN 2009	2009										52	2	0	5	2	55			0305-0483			WOS:000259851900017	20161166	J	Tseng, Fang-Mei; Chiu, Yu-Jing; Chen, Ja-Shen								Measuring business performance in the high-tech manufacturing industry: A case study of Taiwan's large-sized TFT-LCD panel companies								OMEGA-INTERNATIONAL JOURNAL OF MANAGEMENT SCIENCE				37	3			686	697		10.1016/j.omega.2007.07.004					JUN 2009	2009										66	0	0	1	0	66			0305-0483			WOS:000259851900018		J	Driouchi, Tarik; Leseure, Michel; Bennett, David				Bennett, David J/I-7491-2012	Bennett, David J/0000-0003-1480-8652			A robustness framework for monitoring real options under uncertainty								OMEGA-INTERNATIONAL JOURNAL OF MANAGEMENT SCIENCE				37	3			698	710		10.1016/j.omega.2007.09.004					JUN 2009	2009										21	0	0	0	0	21			0305-0483			WOS:000259851900019		J	Ramanathan, Ramakrishnan; Jiang Yunfeng								Incorporating cost and environmental factors in quality function deployment using data envelopment analysis								OMEGA-INTERNATIONAL JOURNAL OF MANAGEMENT SCIENCE				37	3			711	723		10.1016/j.omega.2007.12.003					JUN 2009	2009										57	2	0	2	1	59			0305-0483			WOS:000259851900020		J	Wu, Jun; Li, Jian; Wang, Shouyang; Cheng, T. C. E.				Cheng, T. C. E./D-5688-2015; Cheng, Edwin/K-5403-2019	Cheng, T. C. E./0000-0001-5127-6419; Cheng, Edwin/0000-0001-5127-6419			Mean-variance analysis of the newsvendor model with stockout cost								OMEGA-INTERNATIONAL JOURNAL OF MANAGEMENT SCIENCE				37	3			724	730		10.1016/j.omega.2008.02.005					JUN 2009	2009										95	10	0	2	0	104			0305-0483			WOS:000259851900021		J	Figueira, Jose Rui; Roy, Bernard				Figueira, Jose Rui/J-3194-2012	Figueira, Jose Rui/0000-0001-9822-1167			A note on the paper, "Ranking irregularities when evaluating alternatives by using some ELECTRE methods", by Wang and Triantaphyllou, Omega (2008)								OMEGA-INTERNATIONAL JOURNAL OF MANAGEMENT SCIENCE				37	3			731	733		10.1016/j.omega.2008.05.001					JUN 2009	2009										9	0	0	1	3	12			0305-0483			WOS:000259851900022		J	Laha, Dipak; Sarin, Subhash C.								A heuristic to minimize total flow time in permutation flow shop								OMEGA-INTERNATIONAL JOURNAL OF MANAGEMENT SCIENCE				37	3			734	739		10.1016/j.omega.2008.05.002					JUN 2009	2009										40	1	0	0	0	41			0305-0483			WOS:000259851900023		J	Shanmugam, Ramalingam								At a crossroad of data envelopment and principal component analyses Omega 2007;35(4):351-64 by Ramalingam Shanmugam and Charles Johnson								OMEGA-INTERNATIONAL JOURNAL OF MANAGEMENT SCIENCE				37	3			740	740		10.1016/j.omega.2007.08.001					JUN 2009	2009										0	0	0	0	0	0			0305-0483			WOS:000259851900024		J	Kannan, G.; Kumar, P. Sasi				Govindan, Kannan/M-5996-2017	Govindan, Kannan/0000-0002-6204-1196			Developing the reverse logistics network-A comment and suggestions on minimizing the reverse logistics cost								OMEGA-INTERNATIONAL JOURNAL OF MANAGEMENT SCIENCE				37	3			741	741		10.1016/j.omega.2008.03.001					JUN 2009	2009										4	1	0	1	0	5			0305-0483			WOS:000259851900025		J	Mueller-Merbach, Heiner								OR/MS rationality against managers' will								OMEGA-INTERNATIONAL JOURNAL OF MANAGEMENT SCIENCE				37	2			255	256		10.1016/j.omega.2008.02.003					APR 2009	2009										1	0	0	0	0	1			0305-0483			WOS:000259731200001		J	Chakraborty, Tulika; Giri, B. C.; Chaudhuri, K. S.				Chakraborty, Tulika/I-1704-2019	Chakraborty, Tulika/0000-0003-3539-2772; Giri, Bibhas Chandra/0000-0001-7409-4896			Production lot sizing with process deterioration and machine breakdown under inspection schedule								OMEGA-INTERNATIONAL JOURNAL OF MANAGEMENT SCIENCE				37	2			257	271		10.1016/j.omega.2006.12.001					APR 2009	2009										49	1	0	0	0	50			0305-0483			WOS:000259731200002		J	Ronconi, Debora P.; Henriques, Luis R. S.				Ribas, Imma/L-8946-2014; Ronconi, Debora/P-4084-2015	Ronconi, Debora/0000-0001-7647-2328			Some heuristic algorithms for total tardiness minimization in a flowshop with blocking								OMEGA-INTERNATIONAL JOURNAL OF MANAGEMENT SCIENCE				37	2			272	281		10.1016/j.omega.2007.01.003					APR 2009	2009										47	2	0	1	1	50			0305-0483			WOS:000259731200003		J	Balan, S.; Vrat, Prem; Kumar, Pradeep								RETRACTED: Information distortion in a supply chain and its mitigation using soft computing approach (Retracted article. See vol. 40, pg. 502, 2012)								OMEGA-INTERNATIONAL JOURNAL OF MANAGEMENT SCIENCE				37	2			282	299		10.1016/j.omega.2007.01.004					APR 2009	2009										22	3	0	0	0	25			0305-0483			WOS:000259731200004		J	Akinc, Umit; Meredith, Jack								Modeling the manager's match-or-wait dilemma in a make-to-forecast production situation								OMEGA-INTERNATIONAL JOURNAL OF MANAGEMENT SCIENCE				37	2			300	311		10.1016/j.omega.2007.01.005					APR 2009	2009										4	0	0	0	0	4			0305-0483			WOS:000259731200005		J	Durbach, Ian N.; Stewart, Theodor J.				Stewart, Theodor J/E-8192-2013	Stewart, Theodor J/0000-0002-2107-5955; Durbach, Ian/0000-0003-0769-2153			Using expected values to simplify decision making under uncertainty								OMEGA-INTERNATIONAL JOURNAL OF MANAGEMENT SCIENCE				37	2			312	330		10.1016/j.omega.2007.02.001					APR 2009	2009										31	0	0	2	1	32			0305-0483			WOS:000259731200006		J	Rad, Shahriar Farahmand; Ruiz, Ruben; Boroojerdian, Naser				Ruiz, Ruben/G-3929-2015; Garcia, Ruben Ruiz/L-5381-2019	Ruiz, Ruben/0000-0003-3295-3888; Garcia, Ruben Ruiz/0000-0003-3295-3888			New high performing heuristics for minimizing makespan in permutation flowshops								OMEGA-INTERNATIONAL JOURNAL OF MANAGEMENT SCIENCE				37	2			331	345		10.1016/j.omega.2007.02.002					APR 2009	2009										56	2	0	1	0	57			0305-0483			WOS:000259731200007		J	Graves, Samuel B.; Ringuest, Jeffrey L.					Graves, Samuel/0000-0001-9430-2613			Probabilistic dominance criteria for comparing uncertain alternatives: A tutorial								OMEGA-INTERNATIONAL JOURNAL OF MANAGEMENT SCIENCE				37	2			346	357		10.1016/j.omega.2007.03.001					APR 2009	2009										27	4	0	2	1	31			0305-0483			WOS:000259731200008		J	Bichescu, Bogdan C.; Fry, Michael J.								A numerical analysis of supply chain performance under split decision rights								OMEGA-INTERNATIONAL JOURNAL OF MANAGEMENT SCIENCE				37	2			358	379		10.1016/j.omega.2007.04.001					APR 2009	2009										17	3	0	0	0	20			0305-0483			WOS:000259731200009		J	Orfila-Sintes, Francina; Mattsson, Jan				Orfila-Sintes, Francina/F-5083-2016; Yin, Yimei/G-7749-2012	Orfila-Sintes, Francina/0000-0003-3721-7097; Mattsson, Jan/0000-0002-4121-0114			Innovation behavior in the hotel industry								OMEGA-INTERNATIONAL JOURNAL OF MANAGEMENT SCIENCE				37	2			380	394		10.1016/j.omega.2007.04.002					APR 2009	2009										133	1	0	3	2	135			0305-0483			WOS:000259731200010		J	Jimenez, Antonio; Mateos, Alfonso; Rios-Insua, Sixto				Mateos, A/G-1450-2013; Jimenez-Martin, Antonio/B-9307-2008	Mateos, A/0000-0003-4764-6047; Jimenez-Martin, Antonio/0000-0002-4947-8430			Missing consequences in multiattribute utility theory								OMEGA-INTERNATIONAL JOURNAL OF MANAGEMENT SCIENCE				37	2			395	410		10.1016/j.omega.2007.04.003					APR 2009	2009										18	0	0	0	0	18			0305-0483			WOS:000259731200011		J	Das, Abhiman; Ray, Subhash C.; Nag, Ashok								Labor-use efficiency in Indian banking: A branch-level analysis								OMEGA-INTERNATIONAL JOURNAL OF MANAGEMENT SCIENCE				37	2			411	425		10.1016/j.omega.2007.05.002					APR 2009	2009										27	0	0	0	0	27			0305-0483			WOS:000259731200012		J	Lee, Sang-Yong Tom; Kim, Hee-Woong; Gupta, Sumeet				Lee, Sang Yong Tom/K-8506-2012				Measuring open source software success								OMEGA-INTERNATIONAL JOURNAL OF MANAGEMENT SCIENCE				37	2			426	438		10.1016/j.omega.2007.05.005					APR 2009	2009										56	0	0	0	1	57			0305-0483			WOS:000259731200013		J	Li, Jun; Xu, Jiuping								A novel portfolio selection model in a hybrid uncertain environment								OMEGA-INTERNATIONAL JOURNAL OF MANAGEMENT SCIENCE				37	2			439	449		10.1016/j.omega.2007.06.002					APR 2009	2009										49	3	0	1	0	52			0305-0483			WOS:000259731200014		J	Luque, Mariano; Miettinen, Kaisa; Eskelinen, Petri; Ruiz, Francisco				Ruiz, Francisco/K-4911-2014; Luque, Mariano/K-1006-2014	Ruiz, Francisco/0000-0002-2612-009X; Luque, Mariano/0000-0001-7151-1623; Miettinen, Kaisa/0000-0003-1013-4689			Incorporating preference information in interactive reference point methods for multiobjective optimization								OMEGA-INTERNATIONAL JOURNAL OF MANAGEMENT SCIENCE				37	2			450	462		10.1016/j.omega.2007.06.001					APR 2009	2009										67	2	0	3	1	69			0305-0483			WOS:000259731200015		J	Hughes, Warren R.								A statistical framework for strategic decision making with AHP: Probability assessment and Bayesian revision								OMEGA-INTERNATIONAL JOURNAL OF MANAGEMENT SCIENCE				37	2			463	470		10.1016/j.omega.2007.07.002					APR 2009	2009										12	0	0	0	0	12			0305-0483			WOS:000259731200016		J	Tsai, Wen-Hsien; Hung, Shih-Jieh								Dynamic pricing and revenue management process in Internet retailing under uncertainty: An integrated real options approach								OMEGA-INTERNATIONAL JOURNAL OF MANAGEMENT SCIENCE				37	2			471	481		10.1016/j.omega.2007.07.001					APR 2009	2009										40	1	0	0	0	41			0305-0483			WOS:000259731200017		J	Choi, Jin Ho; Chang, Yong Sik; Han, Ingoo				Han, Ingoo/C-2031-2011				The empirical analysis of the N-bilateral optimized combinatorial auction model								OMEGA-INTERNATIONAL JOURNAL OF MANAGEMENT SCIENCE				37	2			482	493		10.1016/j.omega.2007.07.003					APR 2009	2009										3	0	0	0	0	3			0305-0483			WOS:000259731200018		J	Erginel, Nihal								Untitled								OMEGA-INTERNATIONAL JOURNAL OF MANAGEMENT SCIENCE				37	2			494	494		10.1016/j.omega.2007.01.002					APR 2009	2009										0	0	0	0	0	0			0305-0483			WOS:000259731200019		J	Mueller-Merbach, Heiner								Essential properties of good OR/MS professionals								OMEGA-INTERNATIONAL JOURNAL OF MANAGEMENT SCIENCE				37	1			1	2		10.1016/j.omega.2008.02.004					FEB 2009	2009										3	0	0	0	0	3			0305-0483			WOS:000259436300001		J	Robinson, Powell; Narayanan, Arunachalam; Sahin, Funda								Coordinated deterministic dynamic demand lot-sizing problem: A review of models and algorithms								OMEGA-INTERNATIONAL JOURNAL OF MANAGEMENT SCIENCE				37	1			3	15		10.1016/j.omega.2006.11.004					FEB 2009	2009										74	1	0	1	3	78			0305-0483			WOS:000259436300002		J	Fang, Xiao; Rachamadugu, Ram								Policies for knowledge refreshing in databases								OMEGA-INTERNATIONAL JOURNAL OF MANAGEMENT SCIENCE				37	1			16	28		10.1016/j.omega.2006.07.003					FEB 2009	2009										4	0	0	0	0	4			0305-0483			WOS:000259436300003		J	Wu, Chin-Chun; Chou, Chao-Yu; Huang, Chikong								Optimal price, warranty length and production rate for free replacement policy in the static demand market								OMEGA-INTERNATIONAL JOURNAL OF MANAGEMENT SCIENCE				37	1			29	39		10.1016/j.omega.2006.07.005					FEB 2009	2009										49	5	0	0	0	54			0305-0483			WOS:000259436300004		J	Asmild, Mette; Paradi, Joseph C.; Pastor, Jesus T.				Pastor, Jesus/F-3178-2016; Asmild, Mette/L-9035-2014	Pastor, Jesus/0000-0003-3306-1304; Asmild, Mette/0000-0002-7272-1048			Centralized resource allocation BCC models								OMEGA-INTERNATIONAL JOURNAL OF MANAGEMENT SCIENCE				37	1			40	49		10.1016/j.omega.2006.07.006					FEB 2009	2009										74	5	0	0	1	79			0305-0483			WOS:000259436300005		J	Briec, Walter; Kerstens, Kristiaan				Kerstens, Kristiaan/K-8507-2012; Kerstens, Kristiaan H.J./H-3869-2019	Kerstens, Kristiaan/0000-0003-3358-4332; Kerstens, Kristiaan H.J./0000-0003-3358-4332			Multi-horizon Markowitz portfolio performance appraisals: A general approach								OMEGA-INTERNATIONAL JOURNAL OF MANAGEMENT SCIENCE				37	1			50	62		10.1016/j.omega.2006.07.007					FEB 2009	2009										32	3	0	0	0	35			0305-0483			WOS:000259436300006		J	Bosca, Jose E.; Liern, Vicente; Martinez, Aurelio; Sala, Ramon				Bosca, Jose E./K-8142-2014; Sala-Garrido, Ramon/K-3164-2014	Bosca, Jose E./0000-0001-5238-1237; Sala-Garrido, Ramon/0000-0002-4693-3944; LIERN, VICENTE/0000-0001-5883-9640			Increasing offensive or defensive efficiency? An analysis of Italian and Spanish football								OMEGA-INTERNATIONAL JOURNAL OF MANAGEMENT SCIENCE				37	1			63	78		10.1016/j.omega.2006.08.002					FEB 2009	2009										42	0	0	2	0	42			0305-0483			WOS:000259436300007		J	Lahdelma, Risto; Makkonen, Simo; Salminen, Pekka				Lahdelma, Risto/E-9458-2010	Lahdelma, Risto/0000-0001-7882-2918; Salminen, Pekka/0000-0003-4641-4535			Two ways to handle dependent uncertainties in multi-criteria decision problems								OMEGA-INTERNATIONAL JOURNAL OF MANAGEMENT SCIENCE				37	1			79	92		10.1016/j.omega.2006.08.005					FEB 2009	2009										28	1	0	0	0	29			0305-0483			WOS:000259436300008		J	Wang, Charles X.; Webster, Scott				Wang, Charles X/C-1010-2009	Wang, Charles X/0000-0003-1449-7305			The loss-averse newsvendor problem								OMEGA-INTERNATIONAL JOURNAL OF MANAGEMENT SCIENCE				37	1			93	105		10.1016/j.omega.2006.08.003					FEB 2009	2009										144	45	0	2	0	187			0305-0483			WOS:000259436300009		J	Mitra, Subrata								Analysis of a two-echelon inventory system with returns								OMEGA-INTERNATIONAL JOURNAL OF MANAGEMENT SCIENCE				37	1			106	115		10.1016/j.omega.2006.10.002					FEB 2009	2009										45	3	0	0	0	48			0305-0483			WOS:000259436300010		J	Sanders, Nada R.; Graman, Gregory A.								Quantifying costs of forecast errors: A case study of the warehouse environment								OMEGA-INTERNATIONAL JOURNAL OF MANAGEMENT SCIENCE				37	1			116	125		10.1016/j.omega.2006.10.004					FEB 2009	2009										21	0	0	0	1	22			0305-0483			WOS:000259436300011		J	Martin, Clarence H.								A hybrid genetic algorithm/mathematical programming approach to the multi-family flowshop scheduling problem with lot streaming								OMEGA-INTERNATIONAL JOURNAL OF MANAGEMENT SCIENCE				37	1			126	137		10.1016/j.omega.2006.11.002					FEB 2009	2009										31	4	0	0	0	33			0305-0483			WOS:000259436300012		J	Tuetuencue, G. Yazgi; Carreto, Carlos A. C.; Baker, Barrie M.				Carreto, Carlos/J-1578-2012				A visual interactive approach to classical and mixed vehicle routing problems with backhauls								OMEGA-INTERNATIONAL JOURNAL OF MANAGEMENT SCIENCE				37	1			138	154		10.1016/j.omega.2006.11.001					FEB 2009	2009										18	0	0	0	0	18			0305-0483			WOS:000259436300013		J	Li, Xiaoping; Wang, Qian; Wu, Cheng				Li, Xiaoping/I-8389-2012	Li, Xiaoping/0000-0003-3201-0038			Efficient composite heuristics for total flowtime minimization in permutation flow shops								OMEGA-INTERNATIONAL JOURNAL OF MANAGEMENT SCIENCE				37	1			155	164		10.1016/j.omega.2006.11.003					FEB 2009	2009										69	6	0	2	0	74			0305-0483			WOS:000259436300014		J	Balakrishnan, Jaydeep; Cheng, Chun Hung				Cheng, Chun-Hung/F-6113-2011				The dynamic plant layout problem: Incorporating rolling horizons and forecast uncertainty								OMEGA-INTERNATIONAL JOURNAL OF MANAGEMENT SCIENCE				37	1			165	177		10.1016/j.omega.2006.11.005					FEB 2009	2009										31	2	0	1	0	33			0305-0483			WOS:000259436300015		J	Yan, Shangyao; Tang, Ching-Hui								Inter-city bus scheduling under variable market share and uncertain market demands								OMEGA-INTERNATIONAL JOURNAL OF MANAGEMENT SCIENCE				37	1			178	192		10.1016/j.omega.2006.11.008					FEB 2009	2009										7	0	0	0	1	8			0305-0483			WOS:000259436300016		J	Franco, L. Alberto					Franco, Luis Alberto/0000-0001-6231-8565			Problem structuring methods as intervention tools: Reflections from their use with multi-organisational teams								OMEGA-INTERNATIONAL JOURNAL OF MANAGEMENT SCIENCE				37	1			193	203		10.1016/j.omega.2006.08.001					FEB 2009	2009										25	0	0	1	0	25			0305-0483			WOS:000259436300017		J	Jessop, Alan								A multicriteria blockmodel for performance assessment								OMEGA-INTERNATIONAL JOURNAL OF MANAGEMENT SCIENCE				37	1			204	214		10.1016/j.omega.2006.08.004					FEB 2009	2009										6	0	0	1	1	6			0305-0483			WOS:000259436300018		J	Wang, Shih-Yuan; Chang, Sheng-Lin; Wang, Reay-Chen								Assessment of supplier performance based on product-development strategy by applying multi-granularity linguistic term sets								OMEGA-INTERNATIONAL JOURNAL OF MANAGEMENT SCIENCE				37	1			215	226		10.1016/j.omega.2006.10.003					FEB 2009	2009										29	1	0	0	2	32			0305-0483			WOS:000259436300019		J	Day, Jamison M.; Wright, P. Daniel; Schoenherr, Tobias; Venkataramanan, Munirpallam; Gaudette, Kevin				Schoenherr, Tobias/A-9412-2009	Schoenherr, Tobias/0000-0003-4958-189X			Improving routing and scheduling decisions at a distributor of industrial gasses								OMEGA-INTERNATIONAL JOURNAL OF MANAGEMENT SCIENCE				37	1			227	237		10.1016/j.omega.2006.11.007					FEB 2009	2009										19	2	0	0	0	21			0305-0483			WOS:000259436300020		J	Geldermann, Jutta; Bertsch, Valentin; Treitz, Martin; French, Simon; Papamichail, Konstantinia N.; Hamalainen, Raimo P.					Papamichail, Konstantinia/0000-0001-8307-9620			Multi-criteria decision support and evaluation of strategies for nuclear remediation management								OMEGA-INTERNATIONAL JOURNAL OF MANAGEMENT SCIENCE				37	1			238	251		10.1016/j.omega.2006.11.006					FEB 2009	2009										53	1	0	5	0	54			0305-0483			WOS:000259436300021		J	Yousefi, Ali								A fuzzy set approach for R&D portfolio selection using a real options valuation model (vol 35, pg 247, 2007)								OMEGA-INTERNATIONAL JOURNAL OF MANAGEMENT SCIENCE				37	1			252	252		10.1016/j.omega.2007.01.001					FEB 2009	2009										1	0	0	0	0	1			0305-0483			WOS:000259436300022		J	Wang, John; Yan, Ruiliang; Hollister, Kimberly; Zhu, Dan								A historic review of management science research in China								OMEGA-INTERNATIONAL JOURNAL OF MANAGEMENT SCIENCE				36	6			919	932		10.1016/j.omega.2007.10.004					DEC 2008	2008										24	5	0	2	0	27			0305-0483			WOS:000255311800001		J	Li, Yongjun; Liang, Liang; Chen, Yao; Morita, Hiroshi								Models for measuring and benchmarking olympics achievements								OMEGA-INTERNATIONAL JOURNAL OF MANAGEMENT SCIENCE				36	6			933	940		10.1016/j.omega.2007.05.003					DEC 2008	2008										33	0	0	0	2	35			0305-0483			WOS:000255311800002		J	Jiang, Bin; Reinhardt, Gilles; Young, Scott T.								BOCOG's outsourcing contracts: The vendor's perspective								OMEGA-INTERNATIONAL JOURNAL OF MANAGEMENT SCIENCE				36	6			941	949		10.1016/j.omega.2007.05.004					DEC 2008	2008										12	4	0	0	0	16			0305-0483			WOS:000255311800003		J	Meng, Wei; Zhang, Daqun; Qi, Li; Liu, Wenbin								Two-level DEA approaches in research evaluation								OMEGA-INTERNATIONAL JOURNAL OF MANAGEMENT SCIENCE				36	6			950	957		10.1016/j.omega.2007.12.005					DEC 2008	2008										47	3	0	2	0	49			0305-0483			WOS:000255311800004		J	Kao, Chiang								A linear formulation of the two-level DEA model								OMEGA-INTERNATIONAL JOURNAL OF MANAGEMENT SCIENCE				36	6			958	962		10.1016/j.omega.2008.01.002					DEC 2008	2008										18	0	0	0	0	18			0305-0483			WOS:000255311800005		J	Wu, Jianghua; Zhai, Xin; Huang, Zhimin								Incentives for information sharing in duopoly with capacity constraints								OMEGA-INTERNATIONAL JOURNAL OF MANAGEMENT SCIENCE				36	6			963	975		10.1016/j.omega.2007.10.001					DEC 2008	2008										13	2	0	0	0	15			0305-0483			WOS:000255311800006		J	Tang, Lixin; Wang, Gongshu								Decision support system for the batching problems of steelmaking and continuous-casting production								OMEGA-INTERNATIONAL JOURNAL OF MANAGEMENT SCIENCE				36	6			976	991		10.1016/j.omega.2007.11.002					DEC 2008	2008										50	15	0	0	0	62			0305-0483			WOS:000255311800007		J	Tang, Lixin; Zhao, Yufang								Scheduling a single semi-continuous batching machine								OMEGA-INTERNATIONAL JOURNAL OF MANAGEMENT SCIENCE				36	6			992	1004		10.1016/j.omega.2007.11.003					DEC 2008	2008										15	2	0	0	0	17			0305-0483			WOS:000255311800008		J	Yu, Ming-Miin; Lin, Erwin T. J.								Efficiency and effectiveness in railway performance using a multi-activity network DEA model								OMEGA-INTERNATIONAL JOURNAL OF MANAGEMENT SCIENCE				36	6			1005	1017		10.1016/j.omega.2007.06.003					DEC 2008	2008										145	7	0	4	1	152			0305-0483			WOS:000255311800009		J	Doerner, K. F.; Gutjahr, W. J.; Hartl, R. F.; Strauss, C.; Stummer, C.				Strauss, Christine/Q-3828-2016; Hartl, Richard F/C-7043-2017; Doerner, Karl/B-8769-2008	Strauss, Christine/0000-0003-0276-3610; Hartl, Richard F/0000-0002-0461-0979; Doerner, Karl/0000-0001-8350-1393; Gutjahr, Walter/0000-0003-1494-2501; Stummer, Christian/0000-0001-5495-5740			Nature-inspired metaheuristics for multiobjective activity crashing								OMEGA-INTERNATIONAL JOURNAL OF MANAGEMENT SCIENCE				36	6			1019	1037		10.1016/j.omega.2006.05.001					DEC 2008	2008										11	2	1	0	0	14			0305-0483			WOS:000255311800010		J	Huang, Chi-Cheng; Chu, Pin-Yu; Chiang, Yu-Hsiu								A fuzzy AHP application in government-sponsored R&D project selection								OMEGA-INTERNATIONAL JOURNAL OF MANAGEMENT SCIENCE				36	6			1038	1052		10.1016/j.omega.2006.05.003					DEC 2008	2008										179	2	0	5	3	184			0305-0483			WOS:000255311800011		J	Pan, Xia								Platinum ratio search versus golden ratio search								OMEGA-INTERNATIONAL JOURNAL OF MANAGEMENT SCIENCE				36	6			1053	1056		10.1016/j.omega.2006.05.004					DEC 2008	2008										0	0	0	0	0	0			0305-0483			WOS:000255311800012		J	Garg, Manish; Smith, J. Cole								Models and algorithms for the design of survivable multicommodity flow networks with general failure scenarios								OMEGA-INTERNATIONAL JOURNAL OF MANAGEMENT SCIENCE				36	6			1057	1071		10.1016/j.omega.2006.05.006					DEC 2008	2008										25	0	0	0	0	25			0305-0483			WOS:000255311800013		J	Liang, Wen-Yau; Huang, Chun-Che								A hybrid approach to constrained evolutionary computing: Case of product synthesis								OMEGA-INTERNATIONAL JOURNAL OF MANAGEMENT SCIENCE				36	6			1072	1085		10.1016/j.omega.2006.06.001					DEC 2008	2008										3	0	0	0	0	3			0305-0483			WOS:000255311800014		J	Berling, Peter				Berling, Peter/L-9440-2014				Real options valuation principle in the multi-period base-stock problem								OMEGA-INTERNATIONAL JOURNAL OF MANAGEMENT SCIENCE				36	6			1086	1095		10.1016/j.omega.2006.05.007					DEC 2008	2008										8	0	0	0	0	8			0305-0483			WOS:000255311800015		J	Li, Xiaoming; Sridharan, V.								Characterizing order processes of using (R, nQ) inventory policies in supply chains								OMEGA-INTERNATIONAL JOURNAL OF MANAGEMENT SCIENCE				36	6			1096	1104		10.1016/j.omega.2006.06.002					DEC 2008	2008										9	0	0	0	0	9			0305-0483			WOS:000255311800016		J	Radhakrishnan, Abirami; Zu, Xingxing; Grover, Varun				Wang, Charles/B-5565-2011	Wang, Charles/0000-0001-9331-8437; Grover, Varun/0000-0001-5367-2423			A process-oriented perspective on differential business value creation by information technology: An empirical investigation								OMEGA-INTERNATIONAL JOURNAL OF MANAGEMENT SCIENCE				36	6			1105	1125		10.1016/j.omega.2006.06.003					DEC 2008	2008										64	3	0	1	2	69			0305-0483			WOS:000255311800017		